{
  "type": "constraint",
  "basis": "cited",
  "target": "seed-2-problem",
  "claim": "Rules on waste placement and the level of fines are not something a resident proposal can change; bin capacity, timing and signage are in reach.",
  "evidence_refs": [],
  "uncertainty": "The Amsterdam legal layers are unreviewed stubs, so this is not a legal judgement.",
  "assumptions": [
    "I assume the competence skeleton is a fair starting point."
  ],
  "constraint": "Structural measures only; rule and fine levels sit elsewhere.",
  "source": "institutional",
  "source_ref": "Unreviewed competence skeleton of the Amsterdam overlay (stub, not judged).",
  "recheck_condition": "If the competence skeleton is reviewed and changed."
}
